{
  "name": "weld",
  "displayName": "Weld",
  "type": "dark",
  "background": "#0E0E08",
  "foreground": "#E8E0C0",
  "tokens": {
    "primary": "#98B838",
    "accent": "#E8B040",
    "muted": "#909060",
    "error": "#D06060"
  },
  "ansi": [
    "#0E0E08",
    "#A86050",
    "#7A9848",
    "#B09040",
    "#5A7870",
    "#8870A0",
    "#4A8870",
    "#9A9870",
    "#202018",
    "#D06060",
    "#90C058",
    "#98B838",
    "#909060",
    "#A888C0",
    "#60A880",
    "#E8E0C0"
  ],
  "ui": {
    "cursor": "#E8B040",
    "cursorText": "#0E0E08",
    "selection": "#1C1C10",
    "selectionText": "#E8E0C0",
    "bold": "#E8E0C0",
    "link": "#78C890"
  },
  "prompt": {
    "layout": "two-line-box",
    "showUsername": false,
    "fill": "≡",
    "timePrefix": "⬢",
    "successSymbol": "❯",
    "vimSymbol": "❮"
  }
}
