{
  "name": "graphite",
  "displayName": "Graphite",
  "type": "dark",
  "background": "#0C0C0C",
  "foreground": "#E0E0E0",
  "tokens": {
    "primary": "#C4B8C8",
    "accent": "#D8C8A0",
    "muted": "#808888",
    "error": "#C86060"
  },
  "ansi": [
    "#0C0C0C",
    "#986868",
    "#508858",
    "#988870",
    "#586878",
    "#887888",
    "#508088",
    "#A0A0A0",
    "#202020",
    "#C86060",
    "#68A870",
    "#C4B8C8",
    "#808888",
    "#9888A8",
    "#5898A0",
    "#E0E0E0"
  ],
  "ui": {
    "cursor": "#D8C8A0",
    "cursorText": "#0C0C0C",
    "selection": "#1C1C1C",
    "selectionText": "#E0E0E0",
    "bold": "#E0E0E0",
    "link": "#A898C0"
  },
  "prompt": {
    "layout": "two-line-box",
    "showUsername": false,
    "fill": "⋯",
    "timePrefix": "◑",
    "successSymbol": "❯",
    "vimSymbol": "❮"
  }
}
