{
  "name": "cirrus",
  "displayName": "Cirrus",
  "type": "light",
  "background": "#EEF1F6",
  "foreground": "#181C28",
  "tokens": {
    "primary": "#1E4888",
    "accent": "#1A7060",
    "muted": "#506098",
    "error": "#882028"
  },
  "ansi": [
    "#080C18",
    "#702020",
    "#205428",
    "#504818",
    "#182858",
    "#482858",
    "#184050",
    "#9098B8",
    "#505870",
    "#882028",
    "#287038",
    "#785820",
    "#506098",
    "#1A7060",
    "#288080",
    "#F0F4F8"
  ],
  "ui": {
    "cursor": "#1A7060",
    "cursorText": "#EEF1F6",
    "selection": "#D8E0EC",
    "selectionText": "#181C28",
    "bold": "#080C18",
    "link": "#1E4888"
  },
  "prompt": {
    "layout": "single-line",
    "showUsername": false,
    "fill": "·",
    "timePrefix": "∘",
    "successSymbol": "›",
    "vimSymbol": "‹"
  }
}
